{
  "schemaVersion": 1,
  "domain": "solution-architecture",
  "status": "approved",
  "approvedBy": "project-architecture-owner",
  "approvedAt": "2026-08-29T00:00:00.000Z",
  "decisions": {
    "architecture.style": "modular-monolith",
    "architecture.runtime": "existing-project-runtime",
    "architecture.persistence": "existing-approved-database"
  },
  "references": [
    "docs/architecture/approved-baseline.md"
  ]
}
